{
  "type": "tile_dungeon",
  "title": "The Forgotten Catacombs",
  "description": "Navigate the ancient tile-based dungeon to find the exit and continue your quest.",
  "tilemap": [
    "###############",
    "#.............#",
    "#.###.###.###.#",
    "#.............#",
    "#.###.###.###.#",
    "#.............#",
    "#.###.###.###.#",
    "#.............#",
    "#.###.###.###.#",
    "#.............#",
    "#.###.###.###.#",
    "#.............#",
    "#.###.###.###.#",
    "#.............#",
    "###############"
  ],
  "legend": {
    "#": {
      "type": "Wall",
      "walkable": false,
      "interactable": false,
      "description": "A solid stone wall blocks your path."
    },
    ".": {
      "type": "Floor",
      "walkable": true,
      "interactable": false,
      "description": "Cold stone floor stretches before you."
    },
    "+": {
      "type": "Door",
      "walkable": true,
      "interactable": true,
      "description": "A heavy wooden door. You can open it."
    },
    "@": {
      "type": "Key",
      "walkable": true,
      "interactable": true,
      "description": "A rusty key lies on the floor. You pick it up."
    },
    "*": {
      "type": "Treasure",
      "walkable": true,
      "interactable": true,
      "description": "A chest containing gold and items!"
    },
    "X": {
      "type": "Exit",
      "walkable": true,
      "interactable": true,
      "description": "The exit! You can leave the dungeon now."
    }
  },
  "ui": {
    "showInventory": false,
    "showMap": false,
    "showStats": ["HP", "Level"]
  },
  "controls": "Use WASD or Arrow Keys to move. Press Space to interact with objects.",
  "exitCondition": "Reach the exit tile marked with 'X'"
}
